Time,Actor,Response,AOI,Object
2.02501E+13,agent_344545,"In this painting, Pedro Sunda is depicted with a dynamic pose, dressed in an elegant green velvet suit adorned with golden ribbons and buttons, reflecting the European fashion of the 1640s. The rich colors and the interplay of light and shadow create a vivid atmosphere, emphasizing the significance of the elephant tusk he holds, which symbolizes power and status in this historical context. 

If you’d like, I can guide you to explore other artworks in the exhibition!",B3_Text,B3
2.02501E+13,agent_344545,"In the painting, Pedro Sunda is depicted in a striking pose, dressed in an elaborate green velvet suit that showcases the European fashion of the 1640s, complemented by golden ribbons and a large white collar. The dynamic interplay of light and shadow enhances the composition, highlighting the elephant tusk he holds, which signifies his status and the historical significance of his role in the delegation he was part of. 

Would you like to explore the other artworks in the exhibition?",B3_Background,B3
2.02501E+13,user_344543,This is on purpose that the task is golden shaded or is that just a lighting uh thing,B3_Text,B3
2.02501E+13,agent_344545,"The golden shading on the elephant tusk in the painting is indeed a result of the interplay of light and shadow, which the artist utilizes to create depth and dimensionality. This technique enhances the tusk's significance as a symbol of power and wealth while drawing attention to Pedro Sunda's grasp and the historical context of the scene. 

Would you like to know more about the colors used, the artist’s background, or perhaps other paintings in this exhibition?",Cavalier hat,B2
2.02501E+13,user_344543,Sure please explain,Cavalier hat,B2
2.02501E+13,agent_344545,"The dynamic portrayal of Dom Miguel de Castro exudes a powerful and serious expression, emblematic of his status as a member of the Congolese elite. His attire features fashionable European clothing—a brown woollen riding coat over a silver brocade suit, further enhanced by the striking red ostrich feather on his wide-brimmed cavalier hat, symbolizing elegance and wealth during the 1640s. Would you like to explore the emotional impact of the painting, or perhaps learn about the historical context surrounding Dom Miguel de Castro?",Gilt garment,B2
2.02501E+13,agent_344545,"The powerful portrayal of Dom Miguel de Castro features him in a brown woollen riding coat over a silver brocade suit, signifying his elite status, while the elegant red ostrich feather on his cavalier hat enhances his sense of authority. This striking image not only reflects his fashionable European attire but also represents the complex historical context of his role in trade and diplomacy in the 17th century. 

Would you like to explore the emotional impact of this painting, or would you prefer to move on to another artwork in the exhibition?",Gilt garment,B2
2.02501E+13,user_344543,Is there a reason for the pink ribbon at the bottom of the painting,Gilt garment,B2
2.02501E+13,agent_344545,"The painting is notable for its intricate details, but it seems that I do not have specific information regarding a pink ribbon at the bottom of Dom Miguel de Castro's portrait. This aspect may have significance in terms of style or symbolism. Would you like to explore another aspect of the painting, such as the colors used or the historical context of Dom Miguel de Castro?",Dom Miguel,B2
2.02501E+13,user_344543,Repeat Question,Clothes,B1
2.02501E+13,agent_344545,Could you repeat your question? I might have missed something.,B1_Text,B1
2.02501E+13,user_344543,Could you please explain more about the portrait of Diego bemba,B1_Text,B1
2.02501E+13,agent_344545,"Could you repeat your question? I might have missed something. 

The painting depicts Diego Bemba, a servant of Don Miguel de Castro, holding a small casket likely meant as a diplomatic gift, embodying cultural exchange during a historical period of colonial diplomacy. His upward gaze and gesture suggest reverence or gratitude, which adds depth to the portrayal. Would you like to explore the colors used, the artist’s background, themes, or emotional impact of the portrait?",B1_Text,B1
2.02501E+13,user_344543,Could you please explain if there what type of items or things are usually in the small such small caskets or if it's just a diplomatic gift without anything in it,Clothes,B1
2.02501E+13,agent_344545,"In the painting, Diego Bemba holds a small casket that is likely a diplomatic gift. Such caskets often contained valuable items, including precious objects, artworks, or symbols of goodwill, serving as both presents and tokens of diplomatic relations. Would you like to know more about the significance of the casket in this context or explore another aspect of the painting?",Clothes,B1
2.02501E+13,user_344543,If you have more to tell about the significance of the casket I would like to know,Clothes,B1
2.02501E+13,agent_344545,"The small casket held by Diego Bemba is considered likely a diplomatic gift, symbolizing goodwill and establishing bonds during encounters between different cultures. Such gifts often carried significant meaning, potentially including sacred items or tokens of appreciation that enhanced diplomatic relations between the sender and recipient. Would you like to explore more aspects of the painting or perhaps delve into another artwork in the exhibition?",Doublet,C6
2.02501E+13,user_344543,Please tell me about this painting hat of a boy in a turban,C5_Text,C5
2.02501E+13,agent_344545,"The painting depicts a charming tronie of a young boy dressed in a whimsical costume that includes a turban adorned with a white ostrich feather, captivatingly looking over his shoulder. Created by Gerrit Dou in 1635, this artwork showcases Dou's remarkable attention to detail and his mastery of chiaroscuro, a technique that emphasizes the contrast between light and dark to evoke depth and emotion. Would you like to explore more about the artist, the colors used, or the themes in this painting?",C5_Text,C5
2.02501E+13,user_344543,Repeat Question,C5_Text,C5
2.02501E+13,agent_344545,Could you repeat your question? I might have missed something.,C5_Text,C5
2.02501E+13,agent_344545,"The artwork features a young boy in a fantastical ensemble, including a turban adorned with a white ostrich feather, and he gazes over his shoulder, engaging viewers with innocent charm. This tronie, a form popular in the 17th century that captures facial expressions and costume without identifying the subject, showcases not only the artist's meticulous detail but also his mastery of chiaroscuro, enhancing the visual depth and emotional resonance of the piece. 

If you'd like, we can explore another artwork in this exhibition.",C5_Background,C5
2.02501E+13,user_344543,In the description of the painting it says it is a fantasy costume is it actually completely tied up or is there some real,C5_Background,C5
2.02501E+13,agent_344545,"The young boy in the painting is dressed in a fantastical ensemble that blends various styles from the 17th century, not a representation of a specific cultural or traditional costume. While the attire may not correspond to a real outfit, it incorporates elements like the turban and blue garment that showcase the artist's creativity and attention to detail. Would you like to explore more about the colors used, the artist, the themes of this piece, or perhaps another painting in this exhibition?",C6_Background,C6
2.02501E+13,user_344543,Do you have anything to add to the description of this painting of king Casper,Doublet,C6
2.02501E+13,agent_344545,"In addition to what has been mentioned, the painting exemplifies Haarlem classicism, characterized by its naturalistic style and careful attention to lighting, which highlights King Caspar’s dignified expression. The absence of a background focuses the viewer's attention on his opulent attire and regal demeanor, showcasing the blend of cultural significance and the individual identity of the sitter. Would you like to learn more about the artist, the techniques used, or explore another painting in this exhibition?",C6_Background,C6
2.02501E+13,user_344543,Could you tell me about the patterns on the clothing that he is wearing if there's some significance to that,Incense Pot,C6
2.02501E+13,agent_344545,"In the painting, King Caspar is dressed in a yellow doublet adorned with an intricately detailed cloak, which symbolizes wealth and status through the use of gold accents. The elaborate and luxurious patterns of his clothing reflect the elegance of the 17th century, a period when such attire was a testament to the wearer's power and social standing. Would you like to explore more about the colors used, the artist’s background, or any other aspect of this painting?",Earring,C6
